,Unnamed: 0,id,schema,name,aliases,birth_date,countries,addresses,identifiers,sanctions,phones,emails,dataset,last_seen,first_seen,date_stamp,last_change,new_entry,deletion,unchanged,month,listing_count,listing_date,delisting_date,new_listing_count,iso,country_0,year_id,month_id
252,422,NK-gshm29ASpS5y4EXRRW3C2h,Company,KIRISHIAVTOSERVIS OOO,LIMITED LIABILITY COMPANY KIRISHIAVTOSERVIS;LLC KIRISHIAVTOSERVIS,,ru,"Lit A, 12 Smolenskaya Ulitsa, St. Petersburg, Russia, 196084;Russia",1057807804064;7840016802,13662 Sectoral Directive 4 - Consolidated List - Program - Executive Order 13662 (Ukraine) - 2018-01-26;13662 Sectoral Directive 4 - Sectoral Sanctions Identifications List - Program - Executive Order 13662 (Ukraine) - 2018-01-26,,,US OFAC Consolidated (non-SDN) List,2021-07-26 11:55:45,2021-09-18 12:23:43,20210918,,True,False,False,2021-09,867,20210918,,1,RUS,ru,2021,1
253,426,NK-hErpKj3RZPtzUehfN7mgTa,Company,VTB BANK PUBLIC JOINT STOCK COMPANY,BANK VNESHNEI TORGOVLI RSFSR;BANK VNESHNEY TORGOVLI JOINT STOCK COMPANY;BANK VNESHNEY TORGOVLI OPEN JOINT STOCK COMPANY;BANK VNESHNEY TORGOVLI ROSSIYSKOY FEDERATSII CLOSED JOINT STOCK COMPANY;BANK VTB OAO;BANK VTB OPEN JOINT STOCK COMPANY;Bank VTB PAO;Bank VTB Publichnoe Aktsionernoe Obshchestvo;Bank Vneshei Torgovli OAO;Bank Vneshnei Torgovli Rossiskoi Federatsii as a Private Joint Stock Company;Bank for Foreign Trade of RSFSR;Bank of Foreign Trade of the Russian Federation;CJSC Bank for Foreign Trade of the Russian Federation;JSC VTB BANK;OAO Bank VTB;OAO Vneshtorgbank;OJSC CJSC Bank for Foreign Trade;Russian Vneshtorgbank;VNESHTORGBANK ROSSII CLOSED JOINT STOCK COMPANY;VTB BANK OAO;VTB Bank;VTB Bank PAO;VTB Bank PJSC;VTB Bank open joint stock company;Vneshtorgbank;Vneshtorgbank of RSFSR;Банк ВТБ ПАО;Банк ВТБ публичное акционерное общество,,ru,"11 litera, per. Degtyarny, St. Petersburg, 191144;11, lit A, Degtyarnyy pereulok, St. Petersburg, 191144;29, Bolshaya Morskaya str., St. Petersburg, 190000;37 Plyushchikha ul., Moscow, 119121;43, Vorontsovskaya str., Moscow, 109044;43, bld.1, Vorontsovskaya str., Moscow, 109147;Bashnya Zapad, Kompleks Federatsiya, 12, nab. Presnenskaya, Moscow, 123317;Vorontsovskaya Str 43, Moscow, 109147;str. 1, 43, ul. Vorontsovskaya, Moscow, 109147",00032520;1000;1027739609391;253400V1H6ART1UQ0N98;7702070139;VTBRRUMM,Block - 13662 Sectoral Directive 1 - SDN List - Program - Executive Order 14024 - Executive Order 13662 (Ukraine);Block - Consolidated List - 13662 Sectoral Directive 1 - Program - Executive Order 14024 - Executive Order 13662 (Ukraine);Block - Sectoral Sanctions Identifications List - 13662 Sectoral Directive 1 - Program - Executive Order 14024 - Executive Order 13662 (Ukraine),,,US OFAC Consolidated (non-SDN) List,2022-04-11 18:49:47,2021-09-30 11:39:21,20220411,,True,False,False,2022-04,470,20220411,,1,RUS,ru,2022,3
254,430,NK-hpgeisPcV6qvMv6DYezCu9,Company,"VTB FACTORING, LTD","OBSHCHESTVO S OGRANICHENNOI OTVETSTVENNOSTYU VTB FAKTORING;VTB FACTORING LIMITED;VTB FAKTORING, OOO",,ru,"d. 52 str. 1 nab.Kosmodamianskaya, Moscow, Russia, 115054",5087746611145,13662 Sectoral Directive 1 - Consolidated List - Program - Executive Order 13662 (Ukraine) - 2015-12-22;13662 Sectoral Directive 1 - Sectoral Sanctions Identifications List - Program - Executive Order 13662 (Ukraine) - 2015-12-22,,,US OFAC Consolidated (non-SDN) List,2021-07-26 11:55:45,2021-09-18 12:23:43,20210918,,True,False,False,2021-09,867,20210918,,1,RUS,ru,2021,1
255,431,NK-iAZU8uxiUNtPt59KiDboWN,Company,MULTICARTA,"MULTICARTA, LTD;MULTIKARTA, OOO;OBSHCHESTVO S OGRANICHENNOI OTVETSTVENNOSTYU MULTIKARTA",,ru,"d. 43 korp. 1 ul. Vorontsovskaya, Moscow, 109147",1027739116404,13662 Sectoral Directive 1 - Sectoral Sanctions Identifications List - Program - Executive Order 13662 (Ukraine) - 2015-12-22;Program - Consolidated List - 13662 Sectoral Directive 1 - Executive Order 13662 (Ukraine) - 2015-12-22,,,US OFAC Consolidated (non-SDN) List,2021-09-26 14:52:11,2021-09-28 03:03:19,20210928,,True,False,False,2021-09,867,20210928,,1,RUS,ru,2021,1
256,432,NK-iFtMj9wmqat62EkxPfjF5b,Company,LLC SOVREMENNYE TECHNOLOGII,"MODERN TECHNOLOGIES LIMITED LIABILITY COMPANY;OBSHCHESTVO S OGRANICHENNOI OTVETSTVENNOSTYU SOVREMENNYE TEKHNOLOGII;SOVREMENNYE TEKHNOLOGII, OOO",,ru,"12a Korp. 1str 6 Pr 2-I Yuzhnoportovy, Moscow, Russia, 115432",1037708040468,13662 Sectoral Directive 1 - Consolidated List - Program - Executive Order 13662 (Ukraine) - 2015-12-22;13662 Sectoral Directive 1 - Sectoral Sanctions Identifications List - Program - Executive Order 13662 (Ukraine) - 2015-12-22,,,US OFAC Consolidated (non-SDN) List,2021-07-26 11:55:45,2021-09-18 12:23:43,20210918,,True,False,False,2021-09,867,20210918,,1,RUS,ru,2021,1
257,436,NK-iRqm9CSEc4rUno9fC5iqDB,Company,OJSC ORENBURGNEFT,OAO JSC ORENBURGNEFT;ORENBURGNEFT,,ru,"Magistralnaya St., 2, Buzuluk, the Orenburg Region, Russia, 461040;st. Magistralynaya 2, Buzuluk, Russia, 461040",,13662 Sectoral Directive 4 - 13662 Sectoral Directive 2 - Consolidated List - Program - Executive Order 13662 (Ukraine) - 2015-07-30;13662 Sectoral Directive 4 - 13662 Sectoral Directive 2 - Sectoral Sanctions Identifications List - Program - Executive Order 13662 (Ukraine) - 2015-07-30,,orenburgneft@rosneft.ru,US OFAC Consolidated (non-SDN) List,2021-07-26 11:55:45,2021-09-18 12:23:43,20210918,,True,False,False,2021-09,867,20210918,,1,RUS,ru,2021,1
258,437,NK-iWx5bekNtr99YNQ2EsPFSS,Company,PO URALENERGOMONTAZH ZAO,AO PROIZVODSTVENNOE OBYEDINENIE 'URALENERGOMONTAZH';PO UEM JSC,,ru,"1a Ul.Vladivostokskaya, Ufa, 450078;50, A, Ul. Transportnikov, Berezovski, 623703;7, Liter A, K 4, Ul. Turbinnaya, Ekaterinburg, 620017;Baes A/Ya 7, Zarechny, 624051;D. 11 B Kv. 93, Prospekt Kosmonavtov, Ekaterinburg, 620017;Rp Reftinski, A/Ya 1, Asbest, 624285;Stroibaza Sugres, R-Nvodoka, Per. Tikhi, Verkhnyaya Pyshma, 624070;Stroibaza, Dobryanka, 618740;Transportnikov Street, Building 50 a, Berezovskiy, 623704",1026602949163,Program - 13662 Sectoral Directive 1 - Consolidated List - Executive Order 13662 (Ukraine) - 2016-09-01;Sectoral Sanctions Identifications List - Program - 13662 Sectoral Directive 1 - Executive Order 13662 (Ukraine) - 2016-09-01,,,US OFAC Consolidated (non-SDN) List,2021-09-30 11:39:21,2021-09-30 11:39:21,20210930,,True,False,False,2021-09,867,20210930,,1,RUS,ru,2021,1
259,440,NK-jALpmUe9WLWEzPufEnVdMx,Company,CJSC VANKORNEFT,VANKORNEFT;ZAO VANKORNEFT,,ru,"Dobrovolcheskoy Brigady St., 15, Krasnoyarsk Territory, Russia, 660077",,13662 Sectoral Directive 4 - 13662 Sectoral Directive 2 - Consolidated List - Program - Executive Order 13662 (Ukraine) - 2015-07-30;13662 Sectoral Directive 4 - 13662 Sectoral Directive 2 - Sectoral Sanctions Identifications List - Program - Executive Order 13662 (Ukraine) - 2015-07-30,,info@vankoroil.ru,US OFAC Consolidated (non-SDN) List,2021-07-26 11:55:45,2021-09-18 12:23:43,20210918,,True,False,False,2021-09,867,20210918,,1,RUS,ru,2021,1
260,443,NK-jLcvcAFxBd2aYNeqUvit3a,Company,ROSOBORONEKSPORT OAO,Rosoboroneksport OJSC;Rosoboronexport JSC;Russian Defense Export Rosoboronexport,,ru,"27 Stromynka Ul., Moscow, 107076",1117746521452;56467052;7718852163,Block - Program - Consolidated List - 13662 Sectoral Directive 3 - Executive Order 13662 (Ukraine) - Executive Order 13582 (Syria) - Executive Order 14024;Block - Program - SDN List - 13662 Sectoral Directive 3 - Executive Order 13662 (Ukraine) - Executive Order 13582 (Syria) - Executive Order 14024;Block - Program - Sectoral Sanctions Identifications List - 13662 Sectoral Directive 3 - Executive Order 13662 (Ukraine) - Executive Order 13582 (Syria) - Executive Order 14024,,,US OFAC Consolidated (non-SDN) List,2022-07-22 18:16:56,2021-09-30 11:39:21,20220722,,True,False,False,2022-07,455,20220722,,1,RUS,ru,2022,6
261,444,NK-jNTECMY2fJM592g4WPu4YC,Company,SBERBANK TECHNOLOGIES CLOSED JOINT STOCK COMPANY,"CJSC SBERBANK-TECHNOLOGY;CLOSED JOINT STOCK COMPANY SBERBANK - TECHNOLOGY;SBERTEKH, ZAO;ZAKRYTOE AKTSIONERNOE OBSHCHESTVO SBERBANK -TEKHNOLOGII",,ru,"d.10 nab.Novodanilovskaya, Moscow, Russia, 117105",1117746533926,13662 Sectoral Directive 1 - Consolidated List - Program - Executive Order 13662 (Ukraine) - 2015-12-22;13662 Sectoral Directive 1 - Sectoral Sanctions Identifications List - Program - Executive Order 13662 (Ukraine) - 2015-12-22,,,US OFAC Consolidated (non-SDN) List,2021-07-26 11:55:45,2021-09-18 12:23:43,20210918,,True,False,False,2021-09,867,20210918,,1,RUS,ru,2021,1
262,446,NK-jYh623287dEgPVop9PSJ8b,Company,"SVYAZTRANSNEFT, AO",AKTSIONERNOE OBSHCHESTVO 'SVYAZ OBEKTOV TRANSPORTA I DOBYCHI NEFTI';JSC 'SVYAZTRANSNEFT';OPEN JOINT-STOCK COMPANY 'COMMUNICATION OF THE OBJECTS OF OIL TRANSPORTATION AND EXTRACTION',,ru,"12 ul. Nametkina, Moscow, 117420",00140058;1027739420961;7723011906,13662 Sectoral Directive 2 - Consolidated List - Program - Executive Order 13662 (Ukraine);13662 Sectoral Directive 2 - Sectoral Sanctions Identifications List - Program - Executive Order 13662 (Ukraine),,,US OFAC Consolidated (non-SDN) List,2022-09-03 18:20:09,2021-09-30 11:39:21,20220903,,True,False,False,2022-09,451,20220903,,1,RUS,ru,2022,9
263,447,NK-jhezHx5P3fmkLLrnvFt8sy,Company,"SG MSK, AO",AKTSIONERNOE OBSHCHESTVO 'STRAKHOVAYA GRUPPA MSK';OAO 'STRACHOVAIYA GRUPPA MSK';OPEN JOINT STOK COMPANY 'INSURANCE GROUP MCK';PJSC 'INSURANCE GROUP MSK',,ru,"d. 40, ul. Dolgorukovskaya, Moscow, Russia, 127006",1021602843470;1655006421,13662 Sectoral Directive 1 - Consolidated List - Program - Executive Order 13662 (Ukraine) - 2016-09-01;13662 Sectoral Directive 1 - Sectoral Sanctions Identifications List - Program - Executive Order 13662 (Ukraine) - 2016-09-01,,root@oasopsk.kazan.ru,US OFAC Consolidated (non-SDN) List,2021-07-26 11:55:45,2021-09-18 12:23:43,20210918,,True,False,False,2021-09,867,20210918,,1,RUS,ru,2021,1
264,448,NK-jw4ZFs7hDbfUf746NQGhJe,Company,AKTSIONERNOE OBSHCHESTVO MOSKOVSKI MASHINOSTROITELNY EKSPERIMENTALNY ZAVOD - KOMPOZITSIONNYE TEKHNOLOGII,"JOINT STOCK COMPANY MOSKOW EXPERIMENTAL MACHINE-BUILDING PLANT - COMPOSITE TECHNOLOGIES;MMEZ-KT OJSC;MMEZ-KT, AO;MMEZ-KT-OAO;MOSCOW MECHANICAL EXPERIMENTAL PLANT - COMPOSITE TECHNOLOGIES OPEN JOINT STOCK COMPANY;MOSKOVSKIY MEKHANICHESKIY EKSPERIMENTALNIY ZAVOD - KOMPOZITSIONNYE TEKHNOLOGII;OTKRYTOE AKTSIONERNOE OBSHCHESTVO MOSKOVSKI MEKHANICHESKI EKSPEREMENTALNY ZAVOD",,ru,"d. 9 Pr. 1-I Magistralny, Moscow, Russia, 123290",1037714019815;7714303050,13662 Sectoral Directive 3 - Consolidated List - Program - Executive Order 13662 (Ukraine) - 2015-12-22;13662 Sectoral Directive 3 - Program - Sectoral Sanctions Identifications List - Executive Order 13662 (Ukraine) - 2015-12-22,,9400658@rambler.ru,US OFAC Consolidated (non-SDN) List,2021-07-26 11:55:45,2021-09-18 12:23:43,20210918,,True,False,False,2021-09,867,20210918,,1,RUS,ru,2021,1
265,449,NK-k27x9AUArq8C9jVABWHfEB,Company,KONTSERN ORION OAO,OPEN JOINT-STOCK COMPANY KONTSERN ORION;ORION CONCERN OPEN JOINT STOCK COMPANY,,ru,"Street Malaya Pirogovskaya, D. 18, Bldg. 1, Moscow, 119435",7704731673,Program - Consolidated List - 13662 Sectoral Directive 3 - Executive Order 13662 (Ukraine) - 2015-12-22;Program - Sectoral Sanctions Identifications List - 13662 Sectoral Directive 3 - Executive Order 13662 (Ukraine) - 2015-12-22,,,US OFAC Consolidated (non-SDN) List,2021-09-26 14:52:11,2021-09-28 03:03:19,20210928,,True,False,False,2021-09,867,20210928,,1,RUS,ru,2021,1
266,450,NK-k2MpyKNvzUd4U86EvMTXXY,Company,RN-YUGANSKNEFTEGAZ LLC,RN-YUGANSKNEFTEGAZ OOO;YUGANSKNEFTEGAZ,,ru,"Lenina St., 26, Nefteyugansk, Tyumen Region, Russia, 628309",,13662 Sectoral Directive 4 - 13662 Sectoral Directive 2 - Consolidated List - Program - Executive Order 13662 (Ukraine) - 2015-07-30;13662 Sectoral Directive 4 - 13662 Sectoral Directive 2 - Sectoral Sanctions Identifications List - Program - Executive Order 13662 (Ukraine) - 2015-07-30,,rn_yng@yungjsc.com,US OFAC Consolidated (non-SDN) List,2021-07-26 11:55:45,2021-09-18 12:23:43,20210918,,True,False,False,2021-09,867,20210918,,1,RUS,ru,2021,1
267,451,NK-k2jG2LSawJ5fQyYWqaxqcr,Company,"TRANSNEFT-MEDIA, OOO",LIMITED LIABILITY COMPANY 'TRANSPRESS';LLC 'TRANSPRESS';OBSHCHESTVO S OGRANICHENNOI OTVETSTVENNOSTYU 'TRANSNEFT - MEDIA',,ru,"d. 4 str.1 ul. Shchipok, Moscow, 115093",1027700276218;7734019544,Program - 13662 Sectoral Directive 2 - Consolidated List - Executive Order 13662 (Ukraine) - 2017-06-20;Program - 13662 Sectoral Directive 2 - Sectoral Sanctions Identifications List - Executive Order 13662 (Ukraine) - 2017-06-20,,transpress.ttn@gmail.com,US OFAC Consolidated (non-SDN) List,2021-09-26 14:52:11,2021-09-28 03:03:19,20210928,,True,False,False,2021-09,867,20210928,,1,RUS,ru,2021,1
268,452,NK-k4yY3ZFURxpF3ZFvPgJrsQ,Company,RESAD LLC,"LLC RESAD;OBSHCHESTVO S OGRANICHENNOI OTVETSTVENNOSTYU RESAD;RESAD, OOO",,ru,"d. 5 ul. Bryanskaya, Moscow, 121059",1027739071337,13662 Sectoral Directive 1 - Sectoral Sanctions Identifications List - Program - Executive Order 13662 (Ukraine) - 2015-07-30;Program - Consolidated List - 13662 Sectoral Directive 1 - Executive Order 13662 (Ukraine) - 2015-07-30,,,US OFAC Consolidated (non-SDN) List,2021-09-26 14:52:11,2021-09-28 03:03:19,20210928,,True,False,False,2021-09,867,20210928,,1,RUS,ru,2021,1
269,454,NK-kJmouXXrAsZjkuJGVqtNRy,Company,OOO PS YANDEX.MONEY,LLC PS YANDEX.MONEY;PS YANDEKS.DENGI OOO,,ru,"16 Lva Tolstogo ul., Moscow, Russia, 119021",1077746365113,13662 Sectoral Directive 1 - Consolidated List - Program - Executive Order 13662 (Ukraine) - 2015-12-22;13662 Sectoral Directive 1 - Sectoral Sanctions Identifications List - Program - Executive Order 13662 (Ukraine) - 2015-12-22,,,US OFAC Consolidated (non-SDN) List,2021-07-26 11:55:45,2021-09-18 12:23:43,20210918,,True,False,False,2021-09,867,20210918,,1,RUS,ru,2021,1
270,455,NK-kNULoiM7XfTYeWLtTZ4UHg,Organization,ROSTEC,"ROSTEC STATE CORPORATION;RUSSIAN TECHNOLOGIES;RUSSIAN TECHNOLOGIES STATE CORPORATION FOR ASSISTANCE TO DEVELOPMENT, PRODUCTION AND EXPORT OF ADVANCED TECHNOLOGY INDUSTRIAL PRODUCT;STATE CORPORATION FOR ASSISTANCE TO DEVELOPMENT, PRODUCTION AND EXPORT OF ADVANCED TECHNOLOGY INDUSTRIAL PRODUCT ROSTEKHNOLOGII;STATE CORPORATION ROSTEKHNOLOGII;State Corporation Rostechnologii",,ru,"21 Gogolevsky Blvd., Moscow, Russia, 119991;24 Usacheva ul., Moscow, Russia, 119048",1077799030847;7704274402,13662 Sectoral Directive 3 - Consolidated List - Program - Executive Order 13662 (Ukraine) - 2014-10-10;13662 Sectoral Directive 3 - Program - Sectoral Sanctions Identifications List - Executive Order 13662 (Ukraine) - 2014-09-12,,info@rostec.ru,US OFAC Consolidated (non-SDN) List,2021-07-26 11:55:45,2021-09-18 12:23:43,20210918,,True,False,False,2021-09,867,20210918,,1,RUS,ru,2021,1
271,456,NK-kXVYBzDD6hjfdHFxAmSDc3,Company,SBERBANK TECHNOLOGIES CLOSED JOINT STOCK COMPANY,"CJSC SBERBANK-TECHNOLOGY;CLOSED JOINT STOCK COMPANY SBERBANK - TECHNOLOGY;SBERTEKH, ZAO;ZAKRYTOE AKTSIONERNOE OBSHCHESTVO SBERBANK -TEKHNOLOGII",,ru,"d.10 nab.Novodanilovskaya, Moscow, 117105",1117746533926,Program - 13662 Sectoral Directive 1 - Consolidated List - Executive Order 13662 (Ukraine);Program - 13662 Sectoral Directive 1 - Sectoral Sanctions Identifications List - Executive Order 13662 (Ukraine),,,US OFAC Consolidated (non-SDN) List,2022-04-08 18:24:45,2021-09-30 11:39:21,20220408,,True,False,False,2022-04,470,20220408,,1,RUS,ru,2022,3
272,459,NK-kph4vGHcR4PWZLH5ySLBGC,Company,Открытое Акционерное Общество Российская Электроника,AO Roselektronika;JSC RUSELECTRONICS;JSC Russian Electronics;Open Joint Stock Company Russian Electronics;АО Росэлектроника,,ru,"12 Kosmonavta Volkova, Moscow, 127299;Ul. Vereiskaya D. 29, Str. 141, Moscow, 121357",1027739000475;48532918;7710277994,Block - 13662 Sectoral Directive 3 - Program - Consolidated List - Executive Order 14024 - Executive Order 13662 (Ukraine);Block - 13662 Sectoral Directive 3 - Program - SDN List - Executive Order 14024 - Executive Order 13662 (Ukraine);Block - 13662 Sectoral Directive 3 - Program - Sectoral Sanctions Identifications List - Executive Order 14024 - Executive Order 13662 (Ukraine),,,US OFAC Consolidated (non-SDN) List,2022-12-10 18:19:23,2021-09-30 11:39:21,20221210,,True,False,False,2022-12,450,20221210,,1,RUS,ru,2022,11
273,460,NK-kzDeSwgZcL9YLs9yEcCPJg,Company,"GAZPROM DOBYCHA IRKUTSK, OOO",GAZPROM DOBYCHA IRKUTSK;OBSHCHESTVO S OGRANICHENNOI OTVETSTVENNOSTYU 'GAZPROM DOBYCHA IRKUTSK';Otkrytoe Aktsionernoe Obshchestvo Irkutskgazprom,,ru,"d.14 ul.Nizhnyaya Naberezhnaya, Irkutsk, Irkutskaya obl, Russia, 664011",1073812008731;3812100646,13662 Sectoral Directive 4 - Consolidated List - Program - Executive Order 13662 (Ukraine) - 2016-09-01;13662 Sectoral Directive 4 - Sectoral Sanctions Identifications List - Program - Executive Order 13662 (Ukraine) - 2016-09-01,,mail@irkgazprom.irk.ru,US OFAC Consolidated (non-SDN) List,2021-07-26 11:55:45,2021-09-18 12:23:43,20210918,,True,False,False,2021-09,867,20210918,,1,RUS,ru,2021,1
274,461,NK-m8TW9o46qYXyEGD6YAd5eW,Company,JOINT STOCK COMMERCIAL BANK NOVIKOMBANK,AKTSIONERNY KOMMERCHESKI BANK NOVIKOMBANK AKTSIONERNOE OBSHCHESTVO;AO AKB NOVIKOMBANK;Joint Stock Commercial Bank Novikombank Joint Stock Company;Novikombank AO;Novikombank JCSB;АО АКБ НОВИКОМБАНК;Акционерный Коммерческий Банк Новикомбанк акционерное общество,,ru,"bld.1,Polyanka Bolshaya str. 50/1, Moscow, 119180",1027739075891;17541272;7706196340;CNOVRUMM,Block - 13662 Sectoral Directive 3 - Consolidated List - Program - Executive Order 13662 (Ukraine) - Executive Order 14024;Block - 13662 Sectoral Directive 3 - SDN List - Program - Executive Order 13662 (Ukraine) - Executive Order 14024;Block - Sectoral Sanctions Identifications List - 13662 Sectoral Directive 3 - Program - Executive Order 13662 (Ukraine) - Executive Order 14024,,,US OFAC Consolidated (non-SDN) List,2021-09-30 11:39:21,2022-03-04 18:19:30,20220304,,True,False,False,2022-03,470,20220304,,1,RUS,ru,2022,7
275,462,NK-mKHhk3LKzwJN7adsSsuECb,Company,GAZKARDSERVIS OOO,LIMITED LIABILITY COMPANY GAZKARDSERVIS,,ru,"Obrucheva Street, Building 27, Corpus 2, Moscow, 117630",1027739027634;7724199506,13662 Sectoral Directive 1 - Sectoral Sanctions Identifications List - Program - Executive Order 13662 (Ukraine) - 2016-09-01;Program - Consolidated List - 13662 Sectoral Directive 1 - Executive Order 13662 (Ukraine) - 2016-09-01,,,US OFAC Consolidated (non-SDN) List,2021-09-26 14:52:11,2021-09-28 03:03:19,20210928,,True,False,False,2021-09,867,20210928,,1,RUS,ru,2021,1
276,465,NK-mThLM7CqV7MJAGQCZ23CtC,Company,AKTSIONERNOE OBSHCHESTVO RT-STROITELNYE TEKHNOLOGII,"JOINT STOCK COMPANY RT-CONSTRUCTION TECHNOLOGIES;OPEN JOINT-STOCK COMPANY RT-STROITELNYYE TEKHNOLOGII;RT-STROITELNYE TECHNOLOGIES OAO;RT-STROITELNYE TEKHNOLOGII, AO",,ru,"d. 2 korp., 4 str., 16 kv., 6 per. Bolshoi Savvinski, Moscow, Russia, 119435",1097746324400;7704727853,13662 Sectoral Directive 3 - Consolidated List - Program - Executive Order 13662 (Ukraine) - 2015-12-22;13662 Sectoral Directive 3 - Program - Sectoral Sanctions Identifications List - Executive Order 13662 (Ukraine) - 2015-12-22,,chernyakova-st@stroytech-rt.ru,US OFAC Consolidated (non-SDN) List,2021-07-26 11:55:45,2021-09-18 12:23:43,20210918,,True,False,False,2021-09,867,20210918,,1,RUS,ru,2021,1
277,466,NK-mTpZcBg6yjhtLyZd5kLhsc,Company,"SHERVUD PREMER, OOO",OBSHCHESTVO S OGRANICHENNOI OTVETSTVENNOSTYU 'SHERVUD PREMER';SHERVUD PREMIER OOO,,ru,"8 per. Olsufevski, Moscow, Russia, 119021",1027700226707;7716160907,13662 Sectoral Directive 2 - Consolidated List - Program - Executive Order 13662 (Ukraine) - 2016-12-20;13662 Sectoral Directive 2 - Sectoral Sanctions Identifications List - Program - Executive Order 13662 (Ukraine) - 2016-12-20,,,US OFAC Consolidated (non-SDN) List,2021-07-26 11:55:45,2021-09-18 12:23:43,20210918,,True,False,False,2021-09,867,20210918,,1,RUS,ru,2021,1
278,467,NK-mrXVCW9jJpDLnbjBWxNmUp,Company,"GAZPROM SVYAZ, OOO",GAZPROM SVYAZ;OBSHCHESTVO S OGRANICHENNOI OTVETSTVENNOSTYU 'GAZPROM SVYAZ',,ru,"d.16 ul.Nametkina, Moscow, Russia, 117997",1027739411457;7740000020,13662 Sectoral Directive 4 - Consolidated List - Program - Executive Order 13662 (Ukraine) - 2016-09-01;13662 Sectoral Directive 4 - Sectoral Sanctions Identifications List - Program - Executive Order 13662 (Ukraine) - 2016-09-01,,a.nosonov@gazprom.ru,US OFAC Consolidated (non-SDN) List,2021-07-26 11:55:45,2021-09-18 12:23:43,20210918,,True,False,False,2021-09,867,20210918,,1,RUS,ru,2021,1
279,468,NK-mrx5wuW7zFtgxiRxnaR2Wq,Company,"TRANSNEFT-DIASKAN, AO",AKTSIONERNOE OBSHCHESTVO 'TRANSNEFT - DIASKAN';JSC 'TRANSNEFT-DIASCAN';JSC CTD 'DIASKAN';OPEN JOINT-STOCK COMPANY 'CENTRE OF TECHNICAL DIAGNOSTICS',,ru,"7 ul. Kuibysheva, Lukhovitsy, Raion Moskovskaya Obl., Russia, 140501",1025007389527;5072703668,13662 Sectoral Directive 2 - Consolidated List - Program - Executive Order 13662 (Ukraine) - 2017-06-20;13662 Sectoral Directive 2 - Sectoral Sanctions Identifications List - Program - Executive Order 13662 (Ukraine) - 2017-06-20,,korotkovaa@ctd.transneft.ru,US OFAC Consolidated (non-SDN) List,2021-07-26 11:55:45,2021-09-18 12:23:43,20210918,,True,False,False,2021-09,867,20210918,,1,RUS,ru,2021,1
280,471,NK-n2yYeGpDXwQa9wKW8QjtYN,Company,"TSUP VSTO, OOO",LIMITED LIABILITY COMPANY 'CENTRE OF MANAGEMENT OF THE PROJECT EASTERN SIBERIA-PACIFIC OCEAN';LLC TSUP VSTO;OBSHCHESTVO S OGRANICHENNOI OTVETSTVENNOSTYU 'TSENTR UPRAVLENIYA PROEKTOM 'VOSTOCHNAYA SIBIR - TIKHI OKEAN',,ru,"2-B ul. Gorkogo, Angarsk, Irkutskaya Obl., Russia, 665830",1053801124519;3801079270,13662 Sectoral Directive 2 - Consolidated List - Program - Executive Order 13662 (Ukraine) - 2017-06-20;13662 Sectoral Directive 2 - Sectoral Sanctions Identifications List - Program - Executive Order 13662 (Ukraine) - 2017-06-20,,,US OFAC Consolidated (non-SDN) List,2021-07-26 11:55:45,2021-09-18 12:23:43,20210918,,True,False,False,2021-09,867,20210918,,1,RUS,ru,2021,1
281,473,NK-nLDmEpgDAwdT9GhUYbU8wM,Company,"VELICHKOVSKI ELEVATOR, OAO",OPEN JOINT STOCK COMPANY 'Velichkovskiy Elevator';OTKRYTOE AKTSIONERNOE OBSHCHESTVO 'VELICHKOVSKI ELEVATOR';Otkrytoe Aktsionernoe Obshchestvo Otkrytogo TIPA Velichkovski Elevator,,ru,"1 Elevatornaya Str., Starovelichkovskaya Village, Kalininskiy District, Krasnodar Region, Russia;1 ul. Elevatornaya Stanitsa Straovelichkovskaya, Kalininski Raion, Karsnodarski Kr., Russia, 353793",1022303950360;2333003442,13662 Sectoral Directive 1 - Consolidated List - Program - Executive Order 13662 (Ukraine) - 2016-12-20;13662 Sectoral Directive 1 - Sectoral Sanctions Identifications List - Program - Executive Order 13662 (Ukraine) - 2016-12-20,,velsilos@mail.ru,US OFAC Consolidated (non-SDN) List,2021-07-26 11:55:45,2021-09-18 12:23:43,20210918,,True,False,False,2021-09,867,20210918,,1,RUS,ru,2021,1
282,474,NK-nNdBF5dkL2GhebiDz64R5v,Company,UNITED COMPANY OJSC,OAO 'OBIDINENAIYA KOMANIYA';OJSC UNITED COMPANY;PJSC 'UNITED COMPANY',,ru,"St. Petersburg, 192177;ul. Ryabinovaya d. 53, Moscow, 121471",,13662 Sectoral Directive 1 - Sectoral Sanctions Identifications List - Program - Executive Order 13662 (Ukraine) - 2016-09-01;Program - Consolidated List - 13662 Sectoral Directive 1 - Executive Order 13662 (Ukraine) - 2016-09-01,,,US OFAC Consolidated (non-SDN) List,2021-09-26 14:52:11,2021-09-28 03:03:19,20210928,,True,False,False,2021-09,867,20210928,,1,RUS,ru,2021,1
283,475,NK-nWnGF3GjPCdxpBAKD7cR62,Company,UNITED INSTRUMENT MANUFACTURING CORPORATION,JSC-UNITED-INSTRUMENT-MANUFACTURING-CORPORATION;UIMC,,ru,"29 / 141 Verejskaya Street, Moscow, 121357;Vereiskaya 29, str. 141, Moscow, 121357",,Program - Consolidated List - 13662 Sectoral Directive 3 - Executive Order 13662 (Ukraine) - 2015-12-22;Program - Sectoral Sanctions Identifications List - 13662 Sectoral Directive 3 - Executive Order 13662 (Ukraine) - 2015-12-22,,info@opkrt.ru,US OFAC Consolidated (non-SDN) List,2021-09-26 14:52:11,2021-09-28 03:03:19,20210928,,True,False,False,2021-09,867,20210928,,1,RUS,ru,2021,1
284,477,NK-nbSUCudW7ow3by28yYPpm5,Company,"BELOGLINSKI ELEVATOR, OAO",Aktsionernoe Obshchestvo Otkrytogo TIPA Beloglinski Elevator;OAO 'BELOGLINSKI ELEVATOR';OPEN JOINT STOCK COMPANY 'BELOGLINSKIY ELEVATOR';OTKRYTOE AKTSIONERNOE OBSHCHESTVO 'BELOGLINSKI ELEVATOR',,ru,"1 Privokzalnaya Str., Belaya Glina Village, Leningradsky District, Krasnodar Region, Russia;1 ul. Privokzalnaya S. Belaya Glina, Beloglinski Raion, Krasnodarski Kr., Russia, 353040",1022303499074;2326002180,13662 Sectoral Directive 1 - Consolidated List - Program - Executive Order 13662 (Ukraine) - 2016-12-20;13662 Sectoral Directive 1 - Sectoral Sanctions Identifications List - Program - Executive Order 13662 (Ukraine) - 2016-12-20,,belnep00@mail.ru,US OFAC Consolidated (non-SDN) List,2021-07-26 11:55:45,2021-09-18 12:23:43,20210918,,True,False,False,2021-09,867,20210918,,1,RUS,ru,2021,1
285,479,NK-o4zwi9yXzuZUbL5ghw2o9Y,Company,VERTOLETY ROSSII AO,OPEN JOINT STOCK COMPANY RUSSIAN HELICOPTERS;RUSSIAN HELICOPTERS JOINT STOCK COMPANY;VERTOLETY ROSSII,,ru,"12 Krasnopresnenskaya naberezhnaya, Moscow, 123610",1077746003334;7731559044;98927243,Consolidated List - 13662 Sectoral Directive 3 - Program - Executive Order 13662 (Ukraine);Sectoral Sanctions Identifications List - 13662 Sectoral Directive 3 - Program - Executive Order 13662 (Ukraine),,info@rus-helicopters.com,US OFAC Consolidated (non-SDN) List,2021-09-30 11:39:21,2022-03-05 18:16:43,20220305,,True,False,False,2022-03,470,20220305,,1,RUS,ru,2022,7
